{
  "schemaVersion": 1,
  "id": "closure-demo",
  "sessionID": "session-demo",
  "parentSessionID": null,
  "closingRevision": 1,
  "state": "closing",
  "reason": "budgetEnd",
  "choice": "unanswered",
  "question": "Willst du den Betriebsaufwand vertiefen, als Wissenslandkarte parken oder den Vorschlag verwerfen?",
  "sourceEvidenceIDs": [
    "ev-1-0",
    "ev-2-0",
    "ev-3-0",
    "ev-4-0"
  ],
  "uniqueSourceCount": 4,
  "followUpState": "ready",
  "graphID": "graph-demo",
  "exportState": "notRequested",
  "startNextAutomatically": false
}
